{
  "intent": "PAY_METRO",
  "language": "en",
  "confidence": 0.94,
  "entities": {
    "merchant": "Delhi Metro Smart Card",
    "amount": 40
  },
  "response_text": "Your routine morning Metro commute is \u20b940 at 8:40 AM. Would you like to proceed with instant UPI recharge?",
  "suggested_actions": [
    "CONFIRM",
    "DISMISS",
    "DETAILS"
  ]
}